reviewId,userName,userImage,content,score,thumbsUpCount,reviewCreatedVersion,at,replyContent,repliedAt,appVersion
108df647-9040-409a-8d92-4e7c6ab1445b,Pengguna Google,https://play-lh.googleusercontent.com/EGemoI2NTXmTsBVtJqk8jxF9rh8ApRWfsIMQSt2uE4OcpQqbFu7f7NbTK05lx80nuSijCz7sc3a277R67g,Bagus,4,0,4.1,2018-05-12 08:42:25,,,4.1
e04c04d1-561c-4f2b-a57c-cee7a0cec495,Pengguna Google,https://play-lh.googleusercontent.com/EGemoI2NTXmTsBVtJqk8jxF9rh8ApRWfsIMQSt2uE4OcpQqbFu7f7NbTK05lx80nuSijCz7sc3a277R67g,Mantap,5,0,3.5,2018-05-11 06:11:44,,,3.5
12932f19-12b9-4cac-bcdf-1d7540e5afb5,Pengguna Google,https://play-lh.googleusercontent.com/EGemoI2NTXmTsBVtJqk8jxF9rh8ApRWfsIMQSt2uE4OcpQqbFu7f7NbTK05lx80nuSijCz7sc3a277R67g,Mantap,5,3,4.2,2018-05-09 07:03:20,"Dear Customer, 

Thanks for the advice, input and support that has been given. 
Please download / update your old apps to our new  Sriwijaya Air Mobile Apps which available on Google Playstore. 
Get our Promotion, other informations and new features!

Thank you for flying with Sriwijaya Air Group.

Regards,
Sriwijaya Air Team",2018-02-19 04:49:38,4.2
4eb4d4a7-34c6-4f97-a5e2-9a834d97dc23,Pengguna Google,https://play-lh.googleusercontent.com/EGemoI2NTXmTsBVtJqk8jxF9rh8ApRWfsIMQSt2uE4OcpQqbFu7f7NbTK05lx80nuSijCz7sc3a277R67g,sriwijaya mantap,5,0,,2018-05-04 15:22:35,,,
a9d9493f-09ec-4f4e-9cec-18644c5f08a3,Pengguna Google,https://play-lh.googleusercontent.com/EGemoI2NTXmTsBVtJqk8jxF9rh8ApRWfsIMQSt2uE4OcpQqbFu7f7NbTK05lx80nuSijCz7sc3a277R67g,good,5,0,4.1,2018-04-30 10:34:44,,,4.1
6b6f0556-d11b-49b8-8a36-058a3fa1fd76,Pengguna Google,https://play-lh.googleusercontent.com/EGemoI2NTXmTsBVtJqk8jxF9rh8ApRWfsIMQSt2uE4OcpQqbFu7f7NbTK05lx80nuSijCz7sc3a277R67g,"Nyaman terbang dgn Sriwijaya Air, terus terjadi yang terbaik!",5,0,,2018-04-30 09:16:48,,,
7f0a4d12-03be-4962-b151-16a9c91c5e73,Pengguna Google,https://play-lh.googleusercontent.com/EGemoI2NTXmTsBVtJqk8jxF9rh8ApRWfsIMQSt2uE4OcpQqbFu7f7NbTK05lx80nuSijCz7sc3a277R67g,Mantap,5,0,3.5,2018-04-30 04:10:21,,,3.5
2a54aea0-cfe7-4228-af01-cc98c928e366,Pengguna Google,https://play-lh.googleusercontent.com/EGemoI2NTXmTsBVtJqk8jxF9rh8ApRWfsIMQSt2uE4OcpQqbFu7f7NbTK05lx80nuSijCz7sc3a277R67g,Bgus apps nya,3,0,,2018-04-29 18:05:17,,,
dfe1afa5-08fd-4727-8dca-43d1222add4d,Pengguna Google,https://play-lh.googleusercontent.com/EGemoI2NTXmTsBVtJqk8jxF9rh8ApRWfsIMQSt2uE4OcpQqbFu7f7NbTK05lx80nuSijCz7sc3a277R67g,Sriwijaya memang maskapai low cost and service excellent,5,0,3.5,2018-04-27 04:57:24,,,3.5
e1edcd1d-58ce-4f99-b220-e6ca4869bd19,Pengguna Google,https://play-lh.googleusercontent.com/EGemoI2NTXmTsBVtJqk8jxF9rh8ApRWfsIMQSt2uE4OcpQqbFu7f7NbTK05lx80nuSijCz7sc3a277R67g,Kedua kalinya... Moga lancar... Good job,5,0,,2018-04-27 04:45:15,,,
7330cc8d-3ef2-4243-b3e0-dc9f79d1d489,Pengguna Google,https://play-lh.googleusercontent.com/EGemoI2NTXmTsBVtJqk8jxF9rh8ApRWfsIMQSt2uE4OcpQqbFu7f7NbTK05lx80nuSijCz7sc3a277R67g,semoga bisa membantu rute perjalanan,5,0,,2018-04-25 12:35:08,,,
192e9c76-f330-49fa-af49-431d7a22254d,Pengguna Google,https://play-lh.googleusercontent.com/EGemoI2NTXmTsBVtJqk8jxF9rh8ApRWfsIMQSt2uE4OcpQqbFu7f7NbTK05lx80nuSijCz7sc3a277R67g,istimewa,5,0,,2018-04-24 00:52:28,,,
6a17fea8-7b27-429b-b5b8-d1eb878bdaea,Pengguna Google,https://play-lh.googleusercontent.com/EGemoI2NTXmTsBVtJqk8jxF9rh8ApRWfsIMQSt2uE4OcpQqbFu7f7NbTK05lx80nuSijCz7sc3a277R67g,Mantap,5,0,4.1,2018-04-23 09:12:27,,,4.1
144c5598-115a-4738-a25a-f89d73fba631,Pengguna Google,https://play-lh.googleusercontent.com/EGemoI2NTXmTsBVtJqk8jxF9rh8ApRWfsIMQSt2uE4OcpQqbFu7f7NbTK05lx80nuSijCz7sc3a277R67g,"Bagi saya sangat membantu,thank's mbak SRI ,sukses terus",4,0,,2018-04-17 11:47:48,,,
dde03887-837b-4f1e-ab98-9131685d1b47,Pengguna Google,https://play-lh.googleusercontent.com/EGemoI2NTXmTsBVtJqk8jxF9rh8ApRWfsIMQSt2uE4OcpQqbFu7f7NbTK05lx80nuSijCz7sc3a277R67g,Memudahkan org tua yg belum mengerti jaman modern,5,0,4.1,2018-04-16 02:18:47,,,4.1
dd6c372b-b61e-468c-a7c4-532a46e4ab30,Pengguna Google,https://play-lh.googleusercontent.com/EGemoI2NTXmTsBVtJqk8jxF9rh8ApRWfsIMQSt2uE4OcpQqbFu7f7NbTK05lx80nuSijCz7sc3a277R67g,"Sy coba dl, klu bagus rekomend dan tambah bintang...",4,0,,2018-04-14 17:40:59,,,
5425e61e-5818-469c-8dd4-c391acdbc550,Pengguna Google,https://play-lh.googleusercontent.com/EGemoI2NTXmTsBVtJqk8jxF9rh8ApRWfsIMQSt2uE4OcpQqbFu7f7NbTK05lx80nuSijCz7sc3a277R67g,"Luar biasa Sriwijaya Air , selalu jaga kenyamanan pesawat kontrol selalu mesin demi keselamatan penumpang",5,6,4.1,2018-04-13 08:38:36,,,4.1
444b2c53-24b3-4257-aba3-99a2f286e62c,Pengguna Google,https://play-lh.googleusercontent.com/EGemoI2NTXmTsBVtJqk8jxF9rh8ApRWfsIMQSt2uE4OcpQqbFu7f7NbTK05lx80nuSijCz7sc3a277R67g,Mantap,5,0,,2018-04-08 01:35:57,,,
67926057-6ba0-43e2-a160-aecd160193b1,Pengguna Google,https://play-lh.googleusercontent.com/EGemoI2NTXmTsBVtJqk8jxF9rh8ApRWfsIMQSt2uE4OcpQqbFu7f7NbTK05lx80nuSijCz7sc3a277R67g,Pelayanannya nyaman dan mudah..,5,0,,2018-04-07 13:06:48,,,
6d9007cc-e1dd-43f7-ae7e-87aab2839d25,Pengguna Google,https://play-lh.googleusercontent.com/EGemoI2NTXmTsBVtJqk8jxF9rh8ApRWfsIMQSt2uE4OcpQqbFu7f7NbTK05lx80nuSijCz7sc3a277R67g,Ok,4,0,3.5,2018-04-06 11:32:14,"Dear Customer, 

Thanks for the advice, input and support that has been given. 
Please download / update your old apps to our new  Sriwijaya Air Mobile Apps which available on Google Playstore. 
Get our Promotion, other informations and new features!

Thank you for flying with Sriwijaya Air Group.

Regards,
Sriwijaya Air Team",2018-02-19 04:50:45,3.5
0cef4e45-a00c-4056-906d-48cc4c668b2a,Pengguna Google,https://play-lh.googleusercontent.com/EGemoI2NTXmTsBVtJqk8jxF9rh8ApRWfsIMQSt2uE4OcpQqbFu7f7NbTK05lx80nuSijCz7sc3a277R67g,"Bagus sangat aplikasinya. Membantu sekali, memuaskan, bisa milih seat, dan tidak ribet.",5,7,4.1,2018-04-06 09:54:01,,,4.1
7d6ca414-af17-47f7-b8e1-510cd433f7e4,Pengguna Google,https://play-lh.googleusercontent.com/EGemoI2NTXmTsBVtJqk8jxF9rh8ApRWfsIMQSt2uE4OcpQqbFu7f7NbTK05lx80nuSijCz7sc3a277R67g,Sangat terbantu dalam melakukan perjalanan ke tempat tujuan dan kemudahan mendapatkan tiket.,5,0,,2018-03-30 23:34:16,,,
cae8167f-73b5-4607-b87a-85e9a4cf3e00,Pengguna Google,https://play-lh.googleusercontent.com/EGemoI2NTXmTsBVtJqk8jxF9rh8ApRWfsIMQSt2uE4OcpQqbFu7f7NbTK05lx80nuSijCz7sc3a277R67g,Aplikasi yang Sangat Membantu Sekali...,5,1,3.9,2018-03-28 12:25:56,,,3.9
121c7c49-a794-45b0-aad8-463f6b22164d,Pengguna Google,https://play-lh.googleusercontent.com/EGemoI2NTXmTsBVtJqk8jxF9rh8ApRWfsIMQSt2uE4OcpQqbFu7f7NbTK05lx80nuSijCz7sc3a277R67g,Mantaffft,5,0,3.5,2018-03-27 16:22:11,,,3.5
607cb13f-636a-4fbf-9994-184de1e4c844,Pengguna Google,https://play-lh.googleusercontent.com/EGemoI2NTXmTsBVtJqk8jxF9rh8ApRWfsIMQSt2uE4OcpQqbFu7f7NbTK05lx80nuSijCz7sc3a277R67g,Karena klo kemana2 pasti pake sriwijaya,5,0,3.5,2018-03-25 23:30:37,,,3.5
16d185f0-b0b9-479b-8af5-d2ac257345db,Pengguna Google,https://play-lh.googleusercontent.com/EGemoI2NTXmTsBVtJqk8jxF9rh8ApRWfsIMQSt2uE4OcpQqbFu7f7NbTK05lx80nuSijCz7sc3a277R67g,"Pelayanan jam terbang tidak sesuai jadwal alias jam terbang telat,mengecewakan",1,0,,2018-03-20 07:27:24,,,
5f4314e8-fbdf-43f0-a780-2240d2caa6ae,Pengguna Google,https://play-lh.googleusercontent.com/EGemoI2NTXmTsBVtJqk8jxF9rh8ApRWfsIMQSt2uE4OcpQqbFu7f7NbTK05lx80nuSijCz7sc3a277R67g,Mantap👍👍👍,5,0,,2018-03-17 15:20:45,,,
d9dfbea8-1ac8-4f32-8560-4e76556d083d,Pengguna Google,https://play-lh.googleusercontent.com/EGemoI2NTXmTsBVtJqk8jxF9rh8ApRWfsIMQSt2uE4OcpQqbFu7f7NbTK05lx80nuSijCz7sc3a277R67g,"Kenapa sekarang sudah tidak ada rute Makassar Solo PP? . padahal dulu ada, sya mau cari tiketnya sekarang sdh tidak ada. Kenapa demikian?",3,0,3.5,2018-03-17 02:22:17,,,3.5
847c94cc-cc53-4125-bf10-ebabc9c24288,Pengguna Google,https://play-lh.googleusercontent.com/EGemoI2NTXmTsBVtJqk8jxF9rh8ApRWfsIMQSt2uE4OcpQqbFu7f7NbTK05lx80nuSijCz7sc3a277R67g,Aplikasi ini sangat membantu dan byk diskonnya....sriwijaya air is the best,5,0,3.5,2018-03-15 01:55:00,,,3.5
a4b9100b-f097-42e9-9f0b-7c8d565969d6,Pengguna Google,https://play-lh.googleusercontent.com/EGemoI2NTXmTsBVtJqk8jxF9rh8ApRWfsIMQSt2uE4OcpQqbFu7f7NbTK05lx80nuSijCz7sc3a277R67g,Sangat memmudahkan dalam pemesanan tiket dan sangat cepat.. suka sama pelayanannya,5,0,3.5,2018-03-13 04:10:51,,,3.5
513af109-440d-487e-a8dc-20b4db509334,Pengguna Google,https://play-lh.googleusercontent.com/EGemoI2NTXmTsBVtJqk8jxF9rh8ApRWfsIMQSt2uE4OcpQqbFu7f7NbTK05lx80nuSijCz7sc3a277R67g,sangat mudah di gunakan,5,0,3.5,2018-03-12 07:35:57,,,3.5
3379ab9f-818f-461a-b5d3-ffea650abe02,Pengguna Google,https://play-lh.googleusercontent.com/EGemoI2NTXmTsBVtJqk8jxF9rh8ApRWfsIMQSt2uE4OcpQqbFu7f7NbTK05lx80nuSijCz7sc3a277R67g,good enough for airline mobile apps,5,0,,2018-03-10 12:19:13,"Dear Customer, 

Thanks for the advice, input and support that has been given. 
Please download / update your old apps to our new  Sriwijaya Air Mobile Apps which available on Google Playstore. 
Get our Promotion, other informations and new features!

Thank you for flying with Sriwijaya Air Group.

Regards,
Sriwijaya Air Team",2018-02-19 04:48:20,
311a1441-7923-40f4-a365-ab03ddc5bc27,Pengguna Google,https://play-lh.googleusercontent.com/EGemoI2NTXmTsBVtJqk8jxF9rh8ApRWfsIMQSt2uE4OcpQqbFu7f7NbTK05lx80nuSijCz7sc3a277R67g,Sangat membantu,5,0,3.5,2018-03-10 00:24:25,,,3.5
d4d51170-bf71-4378-9f88-ebf93236f4c5,Pengguna Google,https://play-lh.googleusercontent.com/EGemoI2NTXmTsBVtJqk8jxF9rh8ApRWfsIMQSt2uE4OcpQqbFu7f7NbTK05lx80nuSijCz7sc3a277R67g,"Keren, jadi lebih gampang untuk reservasinya,  sukses selalu",5,0,,2018-03-08 09:37:40,,,
97144b17-b73d-46ea-98f6-204bbe71ae10,Pengguna Google,https://play-lh.googleusercontent.com/EGemoI2NTXmTsBVtJqk8jxF9rh8ApRWfsIMQSt2uE4OcpQqbFu7f7NbTK05lx80nuSijCz7sc3a277R67g,Aplikasi yg benar benar membantu dan.mempermudah semua pemesanan Ticket dimanapun  berada. Mantap Sriwijaya Air Group,5,1,3.4,2018-03-08 04:28:32,,,3.4
308d673f-be98-47c5-b5d6-32a61df1bf33,Pengguna Google,https://play-lh.googleusercontent.com/EGemoI2NTXmTsBVtJqk8jxF9rh8ApRWfsIMQSt2uE4OcpQqbFu7f7NbTK05lx80nuSijCz7sc3a277R67g,"Sangat membantu pembelian tiket, check in dll...",5,0,3.4,2018-03-07 05:37:32,,,3.4
31636bec-03fa-43cc-8b5d-a8d9348de591,Pengguna Google,https://play-lh.googleusercontent.com/EGemoI2NTXmTsBVtJqk8jxF9rh8ApRWfsIMQSt2uE4OcpQqbFu7f7NbTK05lx80nuSijCz7sc3a277R67g,"Pengalaman naik Sriwijaya Air tidak mengecewakan , sukses terus Sriwijaya Air !",5,0,,2018-03-07 03:20:51,,,
72d1b5b6-e92a-4df6-ac57-4c200c920654,Pengguna Google,https://play-lh.googleusercontent.com/EGemoI2NTXmTsBVtJqk8jxF9rh8ApRWfsIMQSt2uE4OcpQqbFu7f7NbTK05lx80nuSijCz7sc3a277R67g,"Good apps,  Bravo Sriwijaya Air",5,0,3.5,2018-03-06 05:55:19,,,3.5
780720cc-e026-4af3-a89a-e5a39b4c3d1c,Pengguna Google,https://play-lh.googleusercontent.com/EGemoI2NTXmTsBVtJqk8jxF9rh8ApRWfsIMQSt2uE4OcpQqbFu7f7NbTK05lx80nuSijCz7sc3a277R67g,Aplikasi yg sangat membantu dari pemesanan tiket hingga proses pemilihan tempat duduk/seat ..terima kasih sriwijayaair group.,5,0,,2018-03-06 04:57:24,,,
4e51aec5-2fa9-4e8a-9593-e3b9155257fc,Pengguna Google,https://play-lh.googleusercontent.com/EGemoI2NTXmTsBVtJqk8jxF9rh8ApRWfsIMQSt2uE4OcpQqbFu7f7NbTK05lx80nuSijCz7sc3a277R67g,"terbang jd lbh simple n praktis , mantap 👍👍",5,0,,2018-03-06 02:06:52,,,
138050ed-ce3c-45dc-93b2-13f4d7517f37,Pengguna Google,https://play-lh.googleusercontent.com/EGemoI2NTXmTsBVtJqk8jxF9rh8ApRWfsIMQSt2uE4OcpQqbFu7f7NbTK05lx80nuSijCz7sc3a277R67g,Maju terus sriwijaya air melintasi seluruh indonesia,5,0,,2018-03-06 02:04:17,,,
410f461a-905b-4852-a8f0-d10a5547068f,Pengguna Google,https://play-lh.googleusercontent.com/EGemoI2NTXmTsBVtJqk8jxF9rh8ApRWfsIMQSt2uE4OcpQqbFu7f7NbTK05lx80nuSijCz7sc3a277R67g,Bravo Sriwijaya Air,5,0,,2018-03-06 01:48:34,,,
851398e8-e5bb-4c10-a8f3-68ba6cc94964,Pengguna Google,https://play-lh.googleusercontent.com/EGemoI2NTXmTsBVtJqk8jxF9rh8ApRWfsIMQSt2uE4OcpQqbFu7f7NbTK05lx80nuSijCz7sc3a277R67g,Aplikasi simple yang sangat membantu pemesan tiket Sriwijaya Air,5,0,,2018-03-06 01:45:48,,,
ee351b09-b587-49a8-b275-a478b5f95dd2,Pengguna Google,https://play-lh.googleusercontent.com/EGemoI2NTXmTsBVtJqk8jxF9rh8ApRWfsIMQSt2uE4OcpQqbFu7f7NbTK05lx80nuSijCz7sc3a277R67g,Aplikasinya sangat mudah digunakan dan banyak keuntungannya menggunakan aplikasi ini. Good Job Sriwijaya Air,5,2,3.5,2018-03-06 01:43:59,,,3.5
fb70c459-aa98-41bc-96f2-0ecd4d8f5217,Pengguna Google,https://play-lh.googleusercontent.com/EGemoI2NTXmTsBVtJqk8jxF9rh8ApRWfsIMQSt2uE4OcpQqbFu7f7NbTK05lx80nuSijCz7sc3a277R67g,Aplikasi ok,5,0,3.5,2018-03-06 01:35:20,,,3.5
019e45c3-66ce-49d8-b11f-952c7a0bb9fd,Pengguna Google,https://play-lh.googleusercontent.com/EGemoI2NTXmTsBVtJqk8jxF9rh8ApRWfsIMQSt2uE4OcpQqbFu7f7NbTK05lx80nuSijCz7sc3a277R67g,Mudah digunakan dan dapat diskon lagi. Terima kasih Sriwijaya Air. Bintang 5 lah.,5,2,3.5,2018-03-06 01:24:15,,,3.5
376e54e4-1770-4d95-b695-1ddc11470b9f,Pengguna Google,https://play-lh.googleusercontent.com/EGemoI2NTXmTsBVtJqk8jxF9rh8ApRWfsIMQSt2uE4OcpQqbFu7f7NbTK05lx80nuSijCz7sc3a277R67g,Mudah di akses... Bravo Sriwijaya Air,5,0,,2018-03-06 01:17:06,,,
07cff111-cac5-4839-8f15-e367b30221fb,Pengguna Google,https://play-lh.googleusercontent.com/EGemoI2NTXmTsBVtJqk8jxF9rh8ApRWfsIMQSt2uE4OcpQqbFu7f7NbTK05lx80nuSijCz7sc3a277R67g,Ellegant,5,0,,2018-03-06 01:06:55,,,
d1ecb33a-0ed4-4989-989a-bb9ebf06d206,Pengguna Google,https://play-lh.googleusercontent.com/EGemoI2NTXmTsBVtJqk8jxF9rh8ApRWfsIMQSt2uE4OcpQqbFu7f7NbTK05lx80nuSijCz7sc3a277R67g,"Aplikasi yg mempermudah perjalanan traveling kita , aman, terpercaya...sukses selalu SRIWIJAYA AIR GROUP😘",5,0,3.5,2018-03-06 01:02:16,,,3.5
f07aa317-6917-49d5-842a-9c8cff5b5f1a,Pengguna Google,https://play-lh.googleusercontent.com/EGemoI2NTXmTsBVtJqk8jxF9rh8ApRWfsIMQSt2uE4OcpQqbFu7f7NbTK05lx80nuSijCz7sc3a277R67g,Your flying partner,5,0,,2018-03-06 00:15:05,,,
0b50d39b-292a-41a4-94d8-1fc3bf921b41,Pengguna Google,https://play-lh.googleusercontent.com/EGemoI2NTXmTsBVtJqk8jxF9rh8ApRWfsIMQSt2uE4OcpQqbFu7f7NbTK05lx80nuSijCz7sc3a277R67g,Aplikasi ini simple dan keuren bgt dgn kombinasi warna yg menarik..blon lagi promonyaa...Bravo Sriwijaya Air Group !,5,2,3.5,2018-03-05 15:25:11,,,3.5
db18471f-88dd-4d94-95a8-17748feb42ab,Pengguna Google,https://play-lh.googleusercontent.com/EGemoI2NTXmTsBVtJqk8jxF9rh8ApRWfsIMQSt2uE4OcpQqbFu7f7NbTK05lx80nuSijCz7sc3a277R67g,"Dua Jempol, Makin memanjakan konsumen",5,0,3.5,2018-03-05 14:10:05,,,3.5
7e80354a-98bd-4ee0-bb10-fc9784c5a332,Pengguna Google,https://play-lh.googleusercontent.com/EGemoI2NTXmTsBVtJqk8jxF9rh8ApRWfsIMQSt2uE4OcpQqbFu7f7NbTK05lx80nuSijCz7sc3a277R67g,"Aplikasi ini sangat membantu bagi saya,,, semua ny jdi mudah bisa boking lewat android handphone pko ny bagus bgt deh trus gak mengecewakan 😘😘😘",5,3,3.5,2018-03-05 14:03:04,"Dear Customer, 

Thanks for the advice, input and support that has been given. 
Please download / update your old apps to our new  Sriwijaya Air Mobile Apps which available on Google Playstore. 
Get our Promotion, other informations and new features!

Thank you for flying with Sriwijaya Air Group.

Regards,
Sriwijaya Air Team",2018-02-19 04:51:52,3.5
4b00f50f-4d1a-446c-a8d8-7c5cd8066277,Pengguna Google,https://play-lh.googleusercontent.com/EGemoI2NTXmTsBVtJqk8jxF9rh8ApRWfsIMQSt2uE4OcpQqbFu7f7NbTK05lx80nuSijCz7sc3a277R67g,"Nice apps, sangat2 membantu.. Tingkatkan terus pelayanan buat costumer Sriwijaya Air.. jaya dan sukses selalu..",5,0,3.5,2018-03-05 13:51:25,,,3.5
5b339ce7-0da1-4492-ab05-81ef0928ce0f,Pengguna Google,https://play-lh.googleusercontent.com/EGemoI2NTXmTsBVtJqk8jxF9rh8ApRWfsIMQSt2uE4OcpQqbFu7f7NbTK05lx80nuSijCz7sc3a277R67g,Aplikasinya oke dan sangat mudah diakses.. Sriwijaya Air T.O.P B.G.T sukses selalu..,5,0,3.5,2018-03-05 13:24:41,,,3.5
fbb01a11-f702-4eaf-a868-9fb9317a0556,Pengguna Google,https://play-lh.googleusercontent.com/EGemoI2NTXmTsBVtJqk8jxF9rh8ApRWfsIMQSt2uE4OcpQqbFu7f7NbTK05lx80nuSijCz7sc3a277R67g,Sangat terbantu sekali dengan aplikasi ini..maju terus sriwijaya air,5,0,3.5,2018-03-05 12:59:50,,,3.5
36058dbf-e67f-41c9-a9aa-d490b476a8e7,Pengguna Google,https://play-lh.googleusercontent.com/EGemoI2NTXmTsBVtJqk8jxF9rh8ApRWfsIMQSt2uE4OcpQqbFu7f7NbTK05lx80nuSijCz7sc3a277R67g,"Sangat membantu aplikasi ini serta ada diskon 100ribu pula , mantaaap",5,0,,2018-03-05 12:56:45,,,
910e71b8-f64f-4251-b150-e8621569af0c,Pengguna Google,https://play-lh.googleusercontent.com/EGemoI2NTXmTsBVtJqk8jxF9rh8ApRWfsIMQSt2uE4OcpQqbFu7f7NbTK05lx80nuSijCz7sc3a277R67g,"Terimakasih Sriwijaya Air, Pesan Tiket jadi lebih mudah & Simple, Aplikasi yang sangat membantu. recommended Guys -  I 💖 Sriwijaya Air",5,0,3.5,2018-03-05 12:54:11,,,3.5
1b8acb96-6c85-4071-9c6e-8ecc5bc05d99,Pengguna Google,https://play-lh.googleusercontent.com/EGemoI2NTXmTsBVtJqk8jxF9rh8ApRWfsIMQSt2uE4OcpQqbFu7f7NbTK05lx80nuSijCz7sc3a277R67g,"Tampilan aplikasinx keren kota"" wisata di indonesia...banyak promonya...semakin jaya selalu sriwijaya air...",5,0,3.5,2018-03-05 12:40:01,,,3.5
94100ffa-5f74-42cb-8ccb-1847856aacc5,Pengguna Google,https://play-lh.googleusercontent.com/EGemoI2NTXmTsBVtJqk8jxF9rh8ApRWfsIMQSt2uE4OcpQqbFu7f7NbTK05lx80nuSijCz7sc3a277R67g,"Aplikasi yg sangat membantu dan mempermudah pemesanan tiket,Jaya terus SRIWIJAYA AIR, teruslah bersinergi membangun negeri. Semoga konsumen semakin dimanjakan dengan berbagai pelayanan yang memberi kemudahan..",5,5,3.5,2018-03-05 12:38:04,,,3.5
5e4004bc-7e57-4ad4-b773-faacfa1868e2,Pengguna Google,https://play-lh.googleusercontent.com/EGemoI2NTXmTsBVtJqk8jxF9rh8ApRWfsIMQSt2uE4OcpQqbFu7f7NbTK05lx80nuSijCz7sc3a277R67g,Mantaf. Semua jadi semakin mudah. Ayo tingkatkan terus Sriwijaya Air Group,5,0,3.5,2018-03-05 12:27:09,,,3.5
672b7547-45c6-472c-89a0-94f03cd74887,Pengguna Google,https://play-lh.googleusercontent.com/EGemoI2NTXmTsBVtJqk8jxF9rh8ApRWfsIMQSt2uE4OcpQqbFu7f7NbTK05lx80nuSijCz7sc3a277R67g,Aplikasi yg sangat membatu. Mudah digunakan dan banyak diskonnya...terima kasih sriwijaya air..,5,2,3.5,2018-03-05 12:21:29,,,3.5
b3037ae9-b619-401a-8119-01ff41503c8b,Pengguna Google,https://play-lh.googleusercontent.com/EGemoI2NTXmTsBVtJqk8jxF9rh8ApRWfsIMQSt2uE4OcpQqbFu7f7NbTK05lx80nuSijCz7sc3a277R67g,Sangt membantu untuk mncri tiket,5,0,,2018-03-05 11:17:55,,,
f7a83ecb-e009-4fad-8c7d-249f955adc55,Pengguna Google,https://play-lh.googleusercontent.com/EGemoI2NTXmTsBVtJqk8jxF9rh8ApRWfsIMQSt2uE4OcpQqbFu7f7NbTK05lx80nuSijCz7sc3a277R67g,Makin mudah,5,0,3.5,2018-03-05 11:17:36,,,3.5
53bd0b42-37a3-46ea-9952-1abbc794df05,Pengguna Google,https://play-lh.googleusercontent.com/EGemoI2NTXmTsBVtJqk8jxF9rh8ApRWfsIMQSt2uE4OcpQqbFu7f7NbTK05lx80nuSijCz7sc3a277R67g,Bagus,4,0,,2018-03-04 01:32:08,,,
4bab34c1-bb28-4765-9f8e-d5804cd603b1,Pengguna Google,https://play-lh.googleusercontent.com/EGemoI2NTXmTsBVtJqk8jxF9rh8ApRWfsIMQSt2uE4OcpQqbFu7f7NbTK05lx80nuSijCz7sc3a277R67g,Bisa dapat harga yg miring,4,0,3.4,2018-03-01 08:05:55,,,3.4
19730b31-3697-43bd-8429-5a427a600193,Pengguna Google,https://play-lh.googleusercontent.com/EGemoI2NTXmTsBVtJqk8jxF9rh8ApRWfsIMQSt2uE4OcpQqbFu7f7NbTK05lx80nuSijCz7sc3a277R67g,SEMUA MANTAP,5,0,2.2,2018-02-25 04:41:40,,,2.2
6902afda-5ee4-40e8-99af-7531714af0f4,Pengguna Google,https://play-lh.googleusercontent.com/EGemoI2NTXmTsBVtJqk8jxF9rh8ApRWfsIMQSt2uE4OcpQqbFu7f7NbTK05lx80nuSijCz7sc3a277R67g,Tampilan aplikasinya semakin menarik & mempermudah dgn adanya fasilitas check in.. makasih diskonnya Sriwijaya Air😉,5,1,3.4,2018-02-23 15:13:43,,,3.4
80678331-2f4b-4316-be31-ac4394423168,Pengguna Google,https://play-lh.googleusercontent.com/EGemoI2NTXmTsBVtJqk8jxF9rh8ApRWfsIMQSt2uE4OcpQqbFu7f7NbTK05lx80nuSijCz7sc3a277R67g,Aplikasix gak ribet..promox kecee 😍😍😍,5,0,3.4,2018-02-22 00:05:32,,,3.4
b02cf4f7-730d-490c-a2fb-86845896746e,Pengguna Google,https://play-lh.googleusercontent.com/EGemoI2NTXmTsBVtJqk8jxF9rh8ApRWfsIMQSt2uE4OcpQqbFu7f7NbTK05lx80nuSijCz7sc3a277R67g,"Produk & promonya ok, naikkan lagi diskonya ya & golden seat semoga segera live di aplikasi ini",5,1,3.4,2018-02-21 21:03:14,,,3.4
87576487-c6b3-4603-b872-a170d4e69710,Pengguna Google,https://play-lh.googleusercontent.com/EGemoI2NTXmTsBVtJqk8jxF9rh8ApRWfsIMQSt2uE4OcpQqbFu7f7NbTK05lx80nuSijCz7sc3a277R67g,"Memudahkan check in,,gak perlu repot lagi le kantor cabang,,,cepat dan mudah ...👍",5,1,3.4,2018-02-21 10:53:28,,,3.4
72ff00b8-7428-483b-a5cd-48e2326839c1,Pengguna Google,https://play-lh.googleusercontent.com/EGemoI2NTXmTsBVtJqk8jxF9rh8ApRWfsIMQSt2uE4OcpQqbFu7f7NbTK05lx80nuSijCz7sc3a277R67g,mempermudah dan semakin baik,5,1,3.4,2018-02-17 11:47:20,"Dear Customer, 

Thanks for the advice, input and support that has been given. 
Please download / update your old apps to our new  Sriwijaya Air Mobile Apps which available on Google Playstore. 
Get our Promotion, other informations and new features!

Thank you for flying with Sriwijaya Air Group.

Regards,
Sriwijaya Air Team",2018-02-19 04:48:04,3.4
edd87fad-65b0-44a2-94e6-26b6b0032563,Pengguna Google,https://play-lh.googleusercontent.com/EGemoI2NTXmTsBVtJqk8jxF9rh8ApRWfsIMQSt2uE4OcpQqbFu7f7NbTK05lx80nuSijCz7sc3a277R67g,Lebih mudah untuk proses pemesanan tiket,5,0,3.3,2018-02-14 12:42:44,"Dear Customer, 

Thanks for the advice, input and support that has been given. 
Please download / update your old apps to our new  Sriwijaya Air Mobile Apps which available on Google Playstore. 
Get our Promotion, other informations and new features!

Thank you for flying with Sriwijaya Air Group.

Regards,
Sriwijaya Air Team",2018-02-19 04:48:33,3.3
5f8fc600-317d-4e81-8378-2c8c28e94d82,Pengguna Google,https://play-lh.googleusercontent.com/EGemoI2NTXmTsBVtJqk8jxF9rh8ApRWfsIMQSt2uE4OcpQqbFu7f7NbTK05lx80nuSijCz7sc3a277R67g,Good jobs n easy use,5,0,,2018-02-14 04:41:57,"Dear Customer, 

Thanks for the advice, input and support that has been given. 
Please download / update your old apps to our new  Sriwijaya Air Mobile Apps which available on Google Playstore. 
Get our Promotion, other informations and new features!

Thank you for flying with Sriwijaya Air Group.

Regards,
Sriwijaya Air Team",2018-02-19 04:48:38,
2b7d5bef-7237-45b8-9600-2a17f50d475b,Pengguna Google,https://play-lh.googleusercontent.com/EGemoI2NTXmTsBVtJqk8jxF9rh8ApRWfsIMQSt2uE4OcpQqbFu7f7NbTK05lx80nuSijCz7sc3a277R67g,Good luck,5,0,2.3,2018-02-13 07:36:52,"Dear Customer, 

Thanks for the advice, input and support that has been given. 
Please download / update your old apps to our new  Sriwijaya Air Mobile Apps which available on Google Playstore. 
Get our Promotion, other informations and new features!

Thank you for flying with Sriwijaya Air Group.

Regards,
Sriwijaya Air Team",2018-02-19 04:48:41,2.3
2be0f7c2-9ede-48a5-a82b-9a4090e2a72f,Pengguna Google,https://play-lh.googleusercontent.com/EGemoI2NTXmTsBVtJqk8jxF9rh8ApRWfsIMQSt2uE4OcpQqbFu7f7NbTK05lx80nuSijCz7sc3a277R67g,Jelek sekali ngabisin kuota aja,1,0,,2018-02-10 07:16:44,"Dear Customer, 

We apologize for the inconvenience. We have rectified bugs on previous apps, please download / update your old apps to our new  Sriwijaya Air Mobile Apps which available on Google Playstore. Get our Promotion, other informations and new features!

Thank you.

Regards,
Sriwijaya Air Team",2018-02-19 04:30:25,
196eceb6-f47d-44b8-932e-4d272dab6a1e,Pengguna Google,https://play-lh.googleusercontent.com/EGemoI2NTXmTsBVtJqk8jxF9rh8ApRWfsIMQSt2uE4OcpQqbFu7f7NbTK05lx80nuSijCz7sc3a277R67g,"Semoga pelayanan sriwijaya air semakin baik,pengguna makin bertambah dan makin sukses..aamiinn",5,0,2.3,2018-02-09 22:22:22,"Dear Customer, 

Thanks for the advice, input and support that has been given. 
Please download / update your old apps to our new  Sriwijaya Air Mobile Apps which available on Google Playstore. 
Get our Promotion, other informations and new features!

Thank you for flying with Sriwijaya Air Group.

Regards,
Sriwijaya Air Team",2018-02-19 04:48:58,2.3
a4e49d84-2366-4845-ae25-850dddf2d868,Pengguna Google,https://play-lh.googleusercontent.com/EGemoI2NTXmTsBVtJqk8jxF9rh8ApRWfsIMQSt2uE4OcpQqbFu7f7NbTK05lx80nuSijCz7sc3a277R67g,Ini app apa wallpaper ? Cuma gambar sayap doang.. Webnya juga lelet bgt kyk gak keurus,1,0,,2018-02-08 05:00:56,"Dear Customer, 

We apologize for the inconvenience. We have rectified bugs on previous apps, please download / update your old apps to our new  Sriwijaya Air Mobile Apps which available on Google Playstore. Get our Promotion, other informations and new features!

Thank you.

Regards,
Sriwijaya Air Team",2018-02-19 04:30:38,
4db10617-1fd1-4306-ad95-52b6eba4d254,Pengguna Google,https://play-lh.googleusercontent.com/EGemoI2NTXmTsBVtJqk8jxF9rh8ApRWfsIMQSt2uE4OcpQqbFu7f7NbTK05lx80nuSijCz7sc3a277R67g,Membantu sekali,5,0,2.3,2018-02-06 04:35:04,"Dear Customer, 

Thanks for the advice, input and support that has been given. 
Please download / update your old apps to our new  Sriwijaya Air Mobile Apps which available on Google Playstore. 
Get our Promotion, other informations and new features!

Thank you for flying with Sriwijaya Air Group.

Regards,
Sriwijaya Air Team",2018-02-19 04:49:04,2.3
0546d083-9a31-45d7-9e93-f47a3ebcb441,Pengguna Google,https://play-lh.googleusercontent.com/EGemoI2NTXmTsBVtJqk8jxF9rh8ApRWfsIMQSt2uE4OcpQqbFu7f7NbTK05lx80nuSijCz7sc3a277R67g,"Sudah diinstal yang keluar hanya gambar pesawat saja, padahal jaringan lagi kencang2nya. Mohon diperbaiki kembali",1,0,,2018-02-03 16:38:48,"Dear Customer, 

We apologize for the inconvenience. We have rectified bugs on previous apps, please download / update your old apps to our new  Sriwijaya Air Mobile Apps which available on Google Playstore. Get our Promotion, other informations and new features!

Thank you.

Regards,
Sriwijaya Air Team",2018-02-19 04:30:52,
